{
  "schema_version": "1.0.0",
  "publication_years": [
    2025,
    2026
  ],
  "types": [
    {
      "id": "xss",
      "title": "Cross-site scripting (XSS)",
      "description": "Source-established cross-site scripting, including evidence-backed subtypes below and broader browser-origin or worker cases whose narrower subtype is not established.",
      "parent_id": null,
      "aliases": [
        "cross-site-scripting"
      ]
    },
    {
      "id": "stored-xss",
      "title": "Stored XSS",
      "description": "Cross-site scripting where a source establishes that persisted content or state later reaches a browser execution context. Persistence alone is insufficient evidence of XSS.",
      "parent_id": "xss",
      "aliases": [
        "sxss"
      ]
    },
    {
      "id": "reflected-xss",
      "title": "Reflected XSS (RXSS)",
      "description": "Cross-site scripting explicitly tied to untrusted request input in the resulting response. The presence of a reflected value alone does not establish this subtype.",
      "parent_id": "xss",
      "aliases": [
        "rxss"
      ]
    },
    {
      "id": "blind-xss",
      "title": "Blind XSS",
      "description": "Cross-site scripting whose execution occurs in a separate or not directly observable application context, established by source evidence. Blind describes observation context and is not a synonym for stored; both labels may apply only with independent support.",
      "parent_id": "xss",
      "aliases": [
        "bxss"
      ]
    },
    {
      "id": "ssrf",
      "title": "Server-side request forgery (SSRF)",
      "description": "Source-established failures of server request-destination authority. Keep affected configurations, runtime reachability and bounded impact in the linked evidence.",
      "parent_id": null,
      "aliases": [
        "server-side-request-forgery"
      ]
    },
    {
      "id": "ssti",
      "title": "Server-side template injection (SSTI)",
      "description": "Source-established untrusted input being interpreted as server-side template syntax. Broad injection labels, unsafe reflection, template use and server rendering alone do not establish SSTI.",
      "parent_id": null,
      "aliases": [
        "server-side-template-injection"
      ]
    }
  ],
  "memberships": [
    {
      "collection": "report",
      "record_id": "apple-icloud-sharing-consent-safari-origin-boundary-2022",
      "type_id": "xss",
      "basis": "source_explicit",
      "source_ids": [
        "primary"
      ],
      "evidence_location": "Universal cross-site scripting discussion",
      "rationale": "The researcher explicitly identifies universal cross-site scripting involving browser-origin isolation; persisted sharing consent is not evidence of stored XSS.",
      "relevance_note": "Review whether consent survives material content changes and whether cross-application handling preserves browser-origin isolation."
    },
    {
      "collection": "report",
      "record_id": "facebook-sdk-message-authentication-randomness-2023",
      "type_id": "xss",
      "basis": "source_explicit",
      "source_ids": [
        "researcher-writeup"
      ],
      "evidence_location": "DOM-XSS discussion and message-handler analysis",
      "rationale": "The source explicitly describes DOM-XSS; it does not establish stored, reflected or blind classification for this navigation.",
      "relevance_note": "Treat message authenticity and safe browser rendering as separate requirements; unknown original publication remains separate from its later archive header."
    },
    {
      "collection": "report",
      "record_id": "google-idx-worker-message-trust-2025",
      "type_id": "xss",
      "basis": "source_explicit",
      "source_ids": [
        "primary"
      ],
      "evidence_location": "Article title and worker-execution impact discussion",
      "rationale": "The primary researcher labels the finding XSS; execution in a worker does not establish direct DOM access or a narrower subtype.",
      "relevance_note": "Review message authority across browser and worker boundaries while preserving the prior-resource-access requirement and bounded impact."
    },
    {
      "collection": "report",
      "record_id": "meta-conversions-gateway-generated-script-boundary-2025",
      "type_id": "stored-xss",
      "basis": "source_explicit",
      "source_ids": [
        "researcher-writeup"
      ],
      "evidence_location": "Bug #2 backend finding",
      "rationale": "The source identifies stored XSS where persisted configuration becomes generated JavaScript consumed by browsers.",
      "relevance_note": "Preserve context-safe serialization when configuration is later emitted as executable browser content; the archive header does not establish a 2026 publication."
    },
    {
      "collection": "report",
      "record_id": "meta-conversions-gateway-message-origin-boundary-2024",
      "type_id": "xss",
      "basis": "source_explicit",
      "source_ids": [
        "researcher-writeup"
      ],
      "evidence_location": "Bug #1 client-side finding",
      "rationale": "The source identifies client-side XSS caused by message-origin data acquiring script authority; Bug #2's stored classification is not transferred to this separate report.",
      "relevance_note": "Review origin authorization and initialization trust while retaining the recorded content-policy, interaction and authenticated-session limits."
    },
    {
      "collection": "report",
      "record_id": "shopify-exchange-request-isolation-2019",
      "type_id": "ssrf",
      "basis": "source_explicit",
      "source_ids": [
        "primary"
      ],
      "evidence_location": "Screenshot-service vulnerability example",
      "rationale": "The vendor explicitly identifies server-side request forgery affecting a bounded screenshot-service infrastructure subset.",
      "relevance_note": "Request-destination policy, metadata isolation and least privilege remain useful service-design lessons; the historical case excludes Shopify core."
    },
    {
      "collection": "resource",
      "record_id": "angular-2026-host-binding-context-authority",
      "type_id": "xss",
      "basis": "source_explicit",
      "source_ids": [
        "maintainer"
      ],
      "evidence_location": "Advisory impact and CWE-79 classification",
      "rationale": "The maintainer identifies XSS where concrete host context loses the expected sanitization protection.",
      "relevance_note": "Resolve security policy against the actual output context rather than a context assumed before composition."
    },
    {
      "collection": "resource",
      "record_id": "angular-2026-raw-content-serialization-context",
      "type_id": "xss",
      "basis": "source_explicit",
      "source_ids": [
        "maintainer"
      ],
      "evidence_location": "Advisory title and Impact",
      "rationale": "The maintainer explicitly identifies SSR XSS; the reviewed evidence does not establish stored, reflected or blind input lifecycle.",
      "relevance_note": "Preserve inert text meaning across serialization and re-parsing, and retain follow-up advisories that qualify the original remediation."
    },
    {
      "collection": "resource",
      "record_id": "axios-2025-base-url-destination-authority",
      "type_id": "ssrf",
      "basis": "source_explicit",
      "source_ids": [
        "advisory"
      ],
      "evidence_location": "Advisory title, Summary and Impact",
      "rationale": "The maintainer explicitly identifies SSRF when caller-controlled URL input defeats an application assumption about destination confinement.",
      "relevance_note": "Treat destination policy and credential scope as explicit application invariants; preserve runtime prerequisites and distinguish historical patch evidence from current safe-input requirements."
    },
    {
      "collection": "resource",
      "record_id": "ci4ms-2026-log-viewer-stored-blind-xss-boundary",
      "basis": "source_explicit",
      "source_ids": [
        "advisory",
        "advisory-database"
      ],
      "type_id": "blind-xss",
      "evidence_location": "Maintainer Description; Advisory Database Summary and Description",
      "rationale": "Both sources explicitly identify blind XSS; the database describes execution in a later administrative view rather than immediate observation by the contributor of logged data.",
      "relevance_note": "Treat diagnostic displays as browser trust boundaries, even when input and execution occur in separate contexts. Preserve the required administrator view and the conflicting interaction metric."
    },
    {
      "collection": "resource",
      "record_id": "ci4ms-2026-log-viewer-stored-blind-xss-boundary",
      "basis": "source_explicit",
      "source_ids": [
        "advisory",
        "advisory-database"
      ],
      "type_id": "stored-xss",
      "evidence_location": "Maintainer title and Description; Advisory Database Summary and Description",
      "rationale": "The maintainer explicitly identifies stored DOM XSS; the database describes retained log content later becoming active in the browser. Persistence is supported independently of the blind observation context.",
      "relevance_note": "Keep persisted diagnostic values inert when read and rendered. Storing a value does not confer trust, and the advisory publication remains separate from later database dates and software-release events."
    },
    {
      "collection": "resource",
      "record_id": "dompurify-2026-cross-realm-sanitization-consistency",
      "type_id": "xss",
      "basis": "source_explicit",
      "source_ids": [
        "maintainer"
      ],
      "evidence_location": "Advisory impact and CWE-79 classification",
      "rationale": "The maintainer identifies XSS when accepted foreign-realm DOM input misses protective checks; later activation alone does not establish stored or blind XSS.",